{
  "task_id": "7806bfe0-a57b-4118-b84f-ebf74c70610f",
  "user_request": "Fix the login validation bug, update docs, run tests, and create a PR.",
  "goal": "Fix the login validation bug, update docs, run tests, and create a PR.",
  "constraints": [],
  "success_criteria": [
    {
      "criterion_id": "622ff8c1-bf57-4bda-8dbc-1af6c7ea4ec9",
      "description": "Bug is fixed: source code diff exists with the change",
      "verifier_type": "file_diff",
      "verifier_config": {},
      "required": true
    },
    {
      "criterion_id": "426318d8-9ae7-4e2f-b177-c8840a0ba2d3",
      "description": "Tests pass: all relevant tests complete without failure",
      "verifier_type": "test_pass",
      "verifier_config": {},
      "required": true
    },
    {
      "criterion_id": "4d0cdc4d-365d-48eb-9138-b63138349e4e",
      "description": "Documentation updated: relevant doc sections exist and are current",
      "verifier_type": "doc_section",
      "verifier_config": {},
      "required": true
    },
    {
      "criterion_id": "fa4b3405-3e5b-482b-8f69-b2979b309cbb",
      "description": "Pull request created or exists in the repository",
      "verifier_type": "pr_exists",
      "verifier_config": {},
      "required": true
    }
  ],
  "expected_state_changes": [
    "Source files modified",
    "Test files updated or added",
    "Documentation updated",
    "Pull request opened"
  ],
  "risk_level": "high",
  "approval_required_for": [
    "pr"
  ],
  "created_at": "2026-06-10T17:45:53.806650Z",
  "tags": []
}